{
  "schemaVersion": "1.0",
  "linkRef": "llllllllllllllllllllllllllllllll",
  "worldRef": {
    "worldId": "10000000-0000-4000-8000-000000000001",
    "realm": "evaluation"
  },
  "target": {
    "kind": "app",
    "ref": "20000000-0000-4000-8000-000000000001"
  },
  "versionPolicy": "current",
  "recipientConstraint": "30000000-0000-4000-8000-000000000001",
  "expiresAt": "2026-09-30T12:00:00Z",
  "state": "active"
}
